{
  "$schema": "orbyss-building-blocks.schema.json",
  "schemaVersion": "1.0",
  "catalogId": "orbyss-building-blocks",
  "resolutionRevision": 6,
  "policy": {
    "source_ownership": "Program Kit owns AI guidance, scaffolding, selection rules, and compatibility tests; runtime source and release tests belong to the component repositories.",
    "versioning": "Pin Foundation, Forms, and Localization independently. Never infer a component version from the Program Kit version.",
    "compatibility": "Program Kit may advance a family pin only after its consumer compatibility suite passes against published immutable packages."
  },
  "sources": {
    "nuget-org": {
      "ecosystem": "nuget",
      "url": "https://api.nuget.org/v3/index.json",
      "patterns": [
        "Orbyss.*"
      ],
      "authentication": {
        "required": false,
        "secret": true
      },
      "availability": "nuget-listed-restorable"
    },
    "github-orbyss-npm": {
      "ecosystem": "npm",
      "url": "https://npm.pkg.github.com",
      "patterns": [
        "@orbyss-io/*"
      ],
      "authentication": {
        "required": true,
        "secret": true,
        "credentialEnvironment": "PROGRAM_KIT_NPM_TOKEN",
        "requiredScope": "read:packages"
      },
      "availability": "npm-metadata-tarball"
    },
    "github-container-registry": {
      "ecosystem": "oci",
      "url": "https://ghcr.io",
      "patterns": [
        "ghcr.io/orbyss-io/foundation-host"
      ],
      "authentication": {
        "required": false,
        "secret": true
      },
      "availability": "oci-manifest-digest"
    }
  },
  "families": {
    "foundation": {
      "repository": "https://github.com/orbyss-io/dotnet-foundation",
      "releaseVersion": "0.3.0",
      "toolVersions": {
        "Orbyss.Foundation.OpenApi.Exporter": "0.2.4"
      }
    },
    "forms": {
      "repository": "https://github.com/orbyss-io/forms",
      "releaseVersion": "0.2.1"
    },
    "localization": {
      "repository": "https://github.com/orbyss-io/localization",
      "releaseVersion": "0.1.2"
    },
    "foundation-build": {
      "repository": "https://github.com/orbyss-io/dotnet-foundation",
      "releaseVersion": "0.3.0"
    }
  },
  "packages": {
    "nuget:Orbyss.Foundation.Analyzers": {
      "packageId": "Orbyss.Foundation.Analyzers",
      "family": "foundation",
      "ecosystem": "nuget",
      "version": "0.3.0",
      "source": "nuget-org",
      "role": "Compile-time enforcement of Foundation feature identity and composition conventions.",
      "materialization": {
        "kind": "nuget-global-analyzer",
        "allowedTargetKinds": [
          "repository"
        ],
        "allowedRoles": [
          "repository"
        ]
      },
      "requires": [],
      "configuration": []
    },
    "nuget:Orbyss.Foundation.Authentication": {
      "packageId": "Orbyss.Foundation.Authentication",
      "family": "foundation",
      "ecosystem": "nuget",
      "version": "0.3.0",
      "source": "nuget-org",
      "role": "Provider-neutral bearer authentication, permission policies, claims transformation, and authentication errors.",
      "materialization": {
        "kind": "nuget-project",
        "allowedTargetKinds": [
          "dotnet-project"
        ],
        "allowedRoles": [
          "api",
          "bridge",
          "composition",
          "helper",
          "implementation",
          "provider"
        ]
      },
      "requires": [
        {
          "package": "nuget:Orbyss.Foundation.Authentication.Core",
          "targetSlot": "same-target"
        }
      ],
      "configuration": [],
      "activations": [
        {
          "featureIdentity": "Orbyss.Foundation.Authentication",
          "targetSlot": "shell"
        }
      ]
    },
    "nuget:Orbyss.Foundation.Authentication.Assurance": {
      "packageId": "Orbyss.Foundation.Authentication.Assurance",
      "family": "foundation",
      "ecosystem": "nuget",
      "version": "0.3.0",
      "source": "nuget-org",
      "role": "Authentication-assurance and step-up authorization requirements.",
      "materialization": {
        "kind": "nuget-project",
        "allowedTargetKinds": [
          "dotnet-project"
        ],
        "allowedRoles": [
          "api",
          "bridge",
          "composition",
          "helper",
          "implementation",
          "provider"
        ]
      },
      "requires": [],
      "configuration": [],
      "activations": [
        {
          "featureIdentity": "Orbyss.Foundation.Authentication.Assurance",
          "targetSlot": "shell"
        }
      ]
    },
    "nuget:Orbyss.Foundation.Authentication.BffCookie": {
      "packageId": "Orbyss.Foundation.Authentication.BffCookie",
      "family": "foundation",
      "ecosystem": "nuget",
      "version": "0.3.0",
      "source": "nuget-org",
      "role": "Server-managed browser session, distributed ticket storage, and antiforgery profile.",
      "materialization": {
        "kind": "nuget-project",
        "allowedTargetKinds": [
          "dotnet-project"
        ],
        "allowedRoles": [
          "api",
          "bridge",
          "composition",
          "helper",
          "implementation",
          "provider"
        ]
      },
      "requires": [],
      "configuration": [],
      "activations": [
        {
          "featureIdentity": "Orbyss.Foundation.Authentication.BffCookie",
          "targetSlot": "shell"
        }
      ]
    },
    "nuget:Orbyss.Foundation.Authentication.ClientCredentials": {
      "packageId": "Orbyss.Foundation.Authentication.ClientCredentials",
      "family": "foundation",
      "ecosystem": "nuget",
      "version": "0.3.0",
      "source": "nuget-org",
      "role": "Cached OAuth client-credentials tokens for machine callers.",
      "materialization": {
        "kind": "nuget-project",
        "allowedTargetKinds": [
          "dotnet-project"
        ],
        "allowedRoles": [
          "api",
          "bridge",
          "composition",
          "helper",
          "implementation",
          "provider"
        ]
      },
      "requires": [],
      "configuration": [],
      "activations": [
        {
          "featureIdentity": "Orbyss.Foundation.Authentication.ClientCredentials",
          "targetSlot": "shell"
        }
      ]
    },
    "nuget:Orbyss.Foundation.Authentication.DownstreamApi": {
      "packageId": "Orbyss.Foundation.Authentication.DownstreamApi",
      "family": "foundation",
      "ecosystem": "nuget",
      "version": "0.3.0",
      "source": "nuget-org",
      "role": "Authenticated downstream HTTP calls using current, exchanged, or machine tokens.",
      "materialization": {
        "kind": "nuget-project",
        "allowedTargetKinds": [
          "dotnet-project"
        ],
        "allowedRoles": [
          "api",
          "bridge",
          "composition",
          "helper",
          "implementation",
          "provider"
        ]
      },
      "requires": [],
      "configuration": [],
      "activations": [
        {
          "featureIdentity": "Orbyss.Foundation.Authentication.DownstreamApi",
          "targetSlot": "shell"
        }
      ]
    },
    "nuget:Orbyss.Foundation.Authentication.DPoP": {
      "packageId": "Orbyss.Foundation.Authentication.DPoP",
      "family": "foundation",
      "ecosystem": "nuget",
      "version": "0.3.0",
      "source": "nuget-org",
      "role": "DPoP proof generation, validation, nonce, and replay protection.",
      "materialization": {
        "kind": "nuget-project",
        "allowedTargetKinds": [
          "dotnet-project"
        ],
        "allowedRoles": [
          "api",
          "bridge",
          "composition",
          "helper",
          "implementation",
          "provider"
        ]
      },
      "requires": [],
      "configuration": [],
      "activations": [
        {
          "featureIdentity": "Orbyss.Foundation.Authentication.DPoP",
          "targetSlot": "shell"
        }
      ]
    },
    "nuget:Orbyss.Foundation.Authentication.SpaPkce": {
      "packageId": "Orbyss.Foundation.Authentication.SpaPkce",
      "family": "foundation",
      "ecosystem": "nuget",
      "version": "0.3.0",
      "source": "nuget-org",
      "role": "Public-client SPA authorization-code plus PKCE profile marker and validation.",
      "materialization": {
        "kind": "nuget-project",
        "allowedTargetKinds": [
          "dotnet-project"
        ],
        "allowedRoles": [
          "api",
          "bridge",
          "composition",
          "helper",
          "implementation",
          "provider"
        ]
      },
      "requires": [],
      "configuration": [],
      "activations": [
        {
          "featureIdentity": "Orbyss.Foundation.Authentication.SpaPkce",
          "targetSlot": "shell"
        }
      ]
    },
    "nuget:Orbyss.Foundation.Authentication.TokenExchange": {
      "packageId": "Orbyss.Foundation.Authentication.TokenExchange",
      "family": "foundation",
      "ecosystem": "nuget",
      "version": "0.3.0",
      "source": "nuget-org",
      "role": "RFC 8693 token exchange service and configuration.",
      "materialization": {
        "kind": "nuget-project",
        "allowedTargetKinds": [
          "dotnet-project"
        ],
        "allowedRoles": [
          "api",
          "bridge",
          "composition",
          "helper",
          "implementation",
          "provider"
        ]
      },
      "requires": [],
      "configuration": [],
      "activations": [
        {
          "featureIdentity": "Orbyss.Foundation.Authentication.TokenExchange",
          "targetSlot": "shell"
        }
      ]
    },
    "nuget:Orbyss.Foundation.DomainEvents": {
      "packageId": "Orbyss.Foundation.DomainEvents",
      "family": "foundation",
      "ecosystem": "nuget",
      "version": "0.3.0",
      "source": "nuget-org",